{
  "schemaVersion": "1.0.0-draft.1",
  "contractKind": "policy",
  "policyId": "default-policy",
  "version": "1.0.0",
  "scope": "project",
  "rules": {
    "allowedConnectors": [],
    "deniedConnectors": [],
    "allowExperimental": false,
    "allowedLicenses": [
      "MIT",
      "Apache-2.0"
    ],
    "allowPaidServices": false,
    "network": {
      "mode": "deny",
      "allowedHosts": []
    },
    "filesystem": {
      "read": [
        "."
      ],
      "write": []
    },
    "allowRemoteProjectContent": false,
    "maxBundleKilobytes": null,
    "requireReducedMotion": true,
    "requiredApprovals": [
      "project-write",
      "command-execution"
    ]
  }
}
